#
# There is insufficient memory for the Java Runtime Environment to continue.
# Native memory allocation (mmap) failed to map 33554432 bytes. Error detail: G1 virtual space
# Possible reasons:
#   The system is out of physical RAM or swap space
#   This process is running with CompressedOops enabled, and the Java Heap may be blocking the growth of the native heap
# Possible solutions:
#   Reduce memory load on the system
#   Increase physical memory or swap space
#   Check if swap backing store is full
#   Decrease Java heap size (-Xmx/-Xms)
#   Decrease number of Java threads
#   Decrease Java thread stack sizes (-Xss)
#   Set larger code cache with -XX:ReservedCodeCacheSize=
#   JVM is running with Zero Based Compressed Oops mode in which the Java heap is
#     placed in the first 32GB address space. The Java Heap base address is the
#     maximum limit for the native heap growth. Please use -XX:HeapBaseMinAddress
#     to set the Java Heap base and to place the Java Heap above 32GB virtual address.
# This output file may be truncated or incomplete.
#
#  Out of Memory Error (os_windows.cpp:3554), pid=19188, tid=12008
#
# JRE version: OpenJDK Runtime Environment Temurin-25+36 (25.0.1+8) (build 25+36-LTS)
# Java VM: OpenJDK 64-Bit Server VM Temurin-25+36 (25.0.1+8-LTS, mixed mode, tiered, compressed oops, compressed class ptrs, g1 gc, windows-amd64)
# Core dump will be written. Default location: c:\Users\federico.molner\Desktop\LaboratorioIntegrato\LaboratorioIntegrato-BID\Connector-java\Connector-java\hs_err_pid19188.mdmp
#

---------------  S U M M A R Y ------------

Command Line: -Dstdout.encoding=UTF-8 -Dstderr.encoding=UTF-8 --enable-native-access=ALL-UNNAMED -Dclassworlds.conf=C:\Users\federico.molner\AppData\Roaming\Code\User\globalStorage\pleiades.java-extension-pack-jdk\maven\latest\bin\m2.conf -Dmaven.home=C:\Users\federico.molner\AppData\Roaming\Code\User\globalStorage\pleiades.java-extension-pack-jdk\maven\latest -Dlibrary.jansi.path=C:\Users\federico.molner\AppData\Roaming\Code\User\globalStorage\pleiades.java-extension-pack-jdk\maven\latest\lib\jansi-native -Dmaven.multiModuleProjectDirectory=c:\Users\federico.molner\Desktop\LaboratorioIntegrato\LaboratorioIntegrato-BID\Connector-java\Connector-java org.codehaus.plexus.classworlds.launcher.Launcher -U -DskipTests clean package

Host: AMD EPYC 9374F 32-Core Processor               , 4 cores, 15G,  Windows Server 2025 , 64 bit Build 26100 (10.0.26100.5074)
Time: Fri Nov 28 11:22:55 2025 ora solare Europa occidentale elapsed time: 18.441227 seconds (0d 0h 0m 18s)

---------------  T H R E A D  ---------------

Current thread (0x000001fdaccfe2e0):  VMThread "VM Thread"          [id=12008, stack(0x000000f8ac100000,0x000000f8ac200000) (1024K)]

Stack: [0x000000f8ac100000,0x000000f8ac200000]
Native frames: (J=compiled Java code, j=interpreted, Vv=VM code, C=native code)
V  [jvm.dll+0x7a8379]  (no source info available)
V  [jvm.dll+0x7729fd]  (no source info available)
V  [jvm.dll+0x9f57b3]  (no source info available)
V  [jvm.dll+0x9f7da1]  (no source info available)
V  [jvm.dll+0x9f84a3]  (no source info available)
V  [jvm.dll+0x2fcd26]  (no source info available)
V  [jvm.dll+0x7a45a5]  (no source info available)
V  [jvm.dll+0x797a07]  (no source info available)
V  [jvm.dll+0x3f4cb8]  (no source info available)
V  [jvm.dll+0x3fcbf6]  (no source info available)
V  [jvm.dll+0x3e938e]  (no source info available)
V  [jvm.dll+0x3e9648]  (no source info available)
V  [jvm.dll+0x3c0b15]  (no source info available)
V  [jvm.dll+0x3c373c]  (no source info available)
V  [jvm.dll+0x3cf901]  (no source info available)
V  [jvm.dll+0x40b92f]  (no source info available)
V  [jvm.dll+0x9fe6d2]  (no source info available)
V  [jvm.dll+0x9ff9f1]  (no source info available)
V  [jvm.dll+0x9fff68]  (no source info available)
V  [jvm.dll+0xa00203]  (no source info available)
V  [jvm.dll+0x99630d]  (no source info available)
V  [jvm.dll+0x7a6955]  (no source info available)
C  [ucrtbase.dll+0x37b0]  (no source info available)
C  [KERNEL32.DLL+0x2e8d7]  (no source info available)
C  [ntdll.dll+0x8d9c]  (no source info available)

VM_Operation (0x000000f8abcff410): G1PauseRemark, mode: safepoint, requested by thread 0x000001fdacb7e4a0


---------------  P R O C E S S  ---------------

Threads class SMR info:
_java_thread_list=0x000001fdd15cf3e0, length=17, elements={
0x000001fdacb093d0, 0x000001fdcc3f56b0, 0x000001fdcc3f6510, 0x000001fdcc3e9df0,
0x000001fdcc3ea9b0, 0x000001fdcc3ec0e0, 0x000001fdcc3ddf80, 0x000001fdaad22f30,
0x000001fdaad1f6c0, 0x000001fdcc5caa40, 0x000001fdcc5ddb50, 0x000001fdd216a020,
0x000001fdd202e4f0, 0x000001fdd25fae90, 0x000001fdd25fed10, 0x000001fdcc447630,
0x000001fdcc44c450
}

Java Threads: ( => current thread )
  0x000001fdacb093d0 JavaThread "main"                              [_thread_blocked, id=19092, stack(0x000000f8aba00000,0x000000f8abb00000) (1024K)]
  0x000001fdcc3f56b0 JavaThread "Reference Handler"          daemon [_thread_blocked, id=12936, stack(0x000000f8ac200000,0x000000f8ac300000) (1024K)]
  0x000001fdcc3f6510 JavaThread "Finalizer"                  daemon [_thread_blocked, id=16736, stack(0x000000f8ac300000,0x000000f8ac400000) (1024K)]
  0x000001fdcc3e9df0 JavaThread "Signal Dispatcher"          daemon [_thread_blocked, id=19172, stack(0x000000f8ac400000,0x000000f8ac500000) (1024K)]
  0x000001fdcc3ea9b0 JavaThread "Attach Listener"            daemon [_thread_blocked, id=13564, stack(0x000000f8ac500000,0x000000f8ac600000) (1024K)]
  0x000001fdcc3ec0e0 JavaThread "Service Thread"             daemon [_thread_blocked, id=8028, stack(0x000000f8ac600000,0x000000f8ac700000) (1024K)]
  0x000001fdcc3ddf80 JavaThread "Monitor Deflation Thread"   daemon [_thread_blocked, id=9008, stack(0x000000f8ac700000,0x000000f8ac800000) (1024K)]
  0x000001fdaad22f30 JavaThread "C2 CompilerThread0"         daemon [_thread_blocked, id=18452, stack(0x000000f8ac800000,0x000000f8ac900000) (1024K)]
  0x000001fdaad1f6c0 JavaThread "C1 CompilerThread0"         daemon [_thread_blocked, id=904, stack(0x000000f8ac900000,0x000000f8aca00000) (1024K)]
  0x000001fdcc5caa40 JavaThread "Notification Thread"        daemon [_thread_blocked, id=15884, stack(0x000000f8aca00000,0x000000f8acb00000) (1024K)]
  0x000001fdcc5ddb50 JavaThread "Common-Cleaner"             daemon [_thread_blocked, id=8376, stack(0x000000f8acb00000,0x000000f8acc00000) (1024K)]
  0x000001fdd216a020 JavaThread "Thread-1"                   daemon [_thread_blocked, id=13868, stack(0x000000f8ad000000,0x000000f8ad100000) (1024K)]
  0x000001fdd202e4f0 JavaThread "C2 CompilerThread1"         daemon [_thread_blocked, id=716, stack(0x000000f8acc00000,0x000000f8acd00000) (1024K)]
  0x000001fdd25fae90 JavaThread "pool-2-thread-1"                   [_thread_blocked, id=17136, stack(0x000000f8ad100000,0x000000f8ad200000) (1024K)]
  0x000001fdd25fed10 JavaThread "pool-2-thread-2"                   [_thread_blocked, id=19272, stack(0x000000f8ad200000,0x000000f8ad300000) (1024K)]
  0x000001fdcc447630 JavaThread "pool-2-thread-3"                   [_thread_blocked, id=17912, stack(0x000000f8ad300000,0x000000f8ad400000) (1024K)]
  0x000001fdcc44c450 JavaThread "pool-2-thread-4"                   [_thread_blocked, id=17008, stack(0x000000f8ad400000,0x000000f8ad500000) (1024K)]
Total: 17

Other Threads:
=>0x000001fdaccfe2e0 VMThread "VM Thread"                           [id=12008, stack(0x000000f8ac100000,0x000000f8ac200000) (1024K)]
  0x000001fdacbc29b0 WatcherThread "VM Periodic Task Thread"        [id=16792, stack(0x000000f8ac000000,0x000000f8ac100000) (1024K)]
  0x000001fdacb64780 WorkerThread "GC Thread#0"                     [id=14624, stack(0x000000f8abb00000,0x000000f8abc00000) (1024K)]
  0x000001fdd1bad040 WorkerThread "GC Thread#1"                     [id=15804, stack(0x000000f8acd00000,0x000000f8ace00000) (1024K)]
  0x000001fdd1bad470 WorkerThread "GC Thread#2"                     [id=1416, stack(0x000000f8ace00000,0x000000f8acf00000) (1024K)]
  0x000001fdd1bad8a0 WorkerThread "GC Thread#3"                     [id=10968, stack(0x000000f8acf00000,0x000000f8ad000000) (1024K)]
  0x000001fdacb7e4a0 ConcurrentGCThread "G1 Main Marker"            [id=14696, stack(0x000000f8abc00000,0x000000f8abd00000) (1024K)]
  0x000001fdacb7ee40 WorkerThread "G1 Conc#0"                       [id=3600, stack(0x000000f8abd00000,0x000000f8abe00000) (1024K)]
  0x000001fdacbb8260 ConcurrentGCThread "G1 Refine#0"               [id=8240, stack(0x000000f8abe00000,0x000000f8abf00000) (1024K)]
  0x000001fdacbb8c70 ConcurrentGCThread "G1 Service"                [id=11596, stack(0x000000f8abf00000,0x000000f8ac000000) (1024K)]
Total: 10

Threads with active compile tasks:
C2 CompilerThread0  18710 9395   !   4       com.google.inject.spi.InjectionPoint::getInjectionPoints (489 bytes)
Total: 1

VM state: at safepoint (normal execution)

VM Mutex/Monitor currently owned by a thread:  ([mutex/lock_event])
[0x00007fffdb8f6368] Threads_lock - owner thread: 0x000001fdaccfe2e0
[0x00007fffdb8f64e8] Heap_lock - owner thread: 0x000001fdacb7e4a0

Heap address: 0x0000000700000000, size: 4096 MB, Compressed Oops mode: Zero based, Oop shift amount: 3

CDS archive(s) not mapped
Compressed class space mapped at: 0x0000000089000000-0x00000000c9000000, reserved size: 1073741824
UseCompressedClassPointers 1, UseCompactObjectHeaders 0
Narrow klass pointer bits 32, Max shift 3
Narrow klass base: 0x0000000000000000, Narrow klass shift: 0
Encoding Range: [0x0000000000000000 - 0x0000000100000000), (4294967296 bytes)
Klass Range:    [0x0000000089000000 - 0x00000000c9000000), (1073741824 bytes)
Klass ID Range:  [2298478592 - 3372220409) (1073741817)
No protection zone.

GC Precious Log:
 CardTable entry size: 512
 Card Set container configuration: InlinePtr #cards 4 size 8 Array Of Cards #cards 16 size 48 Howl #buckets 8 coarsen threshold 3686 Howl Bitmap #cards 512 size 80 coarsen threshold 460 Card regions per heap region 1 cards per card region 4096
 CPUs: 4 total, 4 available
 Memory: 16383M
 Large Page Support: Disabled
 NUMA Support: Disabled
 Compressed Oops: Enabled (Zero based)
 Heap Region Size: 2M
 Heap Min Capacity: 8M
 Heap Initial Capacity: 256M
 Heap Max Capacity: 4G
 Pre-touch: Disabled
 Parallel Workers: 4
 Concurrent Workers: 1
 Concurrent Refinement Workers: 4
 Periodic GC: Disabled

Heap:
 garbage-first heap   total reserved 4194304K, committed 141312K, used 101391K [0x0000000700000000, 0x0000000800000000)
  region size 2048K, 3 young (6144K), 2 survivors (4096K)

Heap Regions: E=young(eden), S=young(survivor), O=old, HS=humongous(starts), HC=humongous(continues), CS=collection set, F=free, TAMS=top-at-mark-start, PB=parsable bottom
|   0|0x0000000700000000, 0x0000000700200000, 0x0000000700200000|100%| O|  |TAMS 0x0000000700200000| PB 0x0000000700200000| Untracked |  0
|   1|0x0000000700200000, 0x0000000700400000, 0x0000000700400000|100%| O|  |TAMS 0x0000000700400000| PB 0x0000000700400000| Untracked |  0
|   2|0x0000000700400000, 0x0000000700600000, 0x0000000700600000|100%| O|  |TAMS 0x0000000700600000| PB 0x0000000700600000| Untracked |  0
|   3|0x0000000700600000, 0x0000000700800000, 0x0000000700800000|100%| O|  |TAMS 0x0000000700800000| PB 0x0000000700800000| Untracked |  0
|   4|0x0000000700800000, 0x0000000700a00000, 0x0000000700a00000|100%| O|Cm|TAMS 0x0000000700a00000| PB 0x0000000700a00000| Updating |  0
|   5|0x0000000700a00000, 0x0000000700bba038, 0x0000000700c00000| 86%| O|  |TAMS 0x0000000700bba038| PB 0x0000000700bba038| Untracked |  0
|   6|0x0000000700c00000, 0x0000000700e00000, 0x0000000700e00000|100%| O|  |TAMS 0x0000000700e00000| PB 0x0000000700e00000| Untracked |  0
|   7|0x0000000700e00000, 0x0000000701000000, 0x0000000701000000|100%|HS|  |TAMS 0x0000000701000000| PB 0x0000000700e00000| Complete |  0
|   8|0x0000000701000000, 0x0000000701200000, 0x0000000701200000|100%| O|  |TAMS 0x0000000701172fc0| PB 0x0000000701172fc0| Untracked |  0
|   9|0x0000000701200000, 0x0000000701400000, 0x0000000701400000|100%| O|  |TAMS 0x0000000701200000| PB 0x0000000701200000| Untracked |  0
|  10|0x0000000701400000, 0x0000000701600000, 0x0000000701600000|100%| O|  |TAMS 0x0000000701600000| PB 0x0000000701600000| Untracked |  0
|  11|0x0000000701600000, 0x0000000701800000, 0x0000000701800000|100%| O|  |TAMS 0x0000000701800000| PB 0x0000000701800000| Untracked |  0
|  12|0x0000000701800000, 0x0000000701a00000, 0x0000000701a00000|100%| O|  |TAMS 0x0000000701a00000| PB 0x0000000701a00000| Untracked |  0
|  13|0x0000000701a00000, 0x0000000701c00000, 0x0000000701c00000|100%| O|  |TAMS 0x0000000701c00000| PB 0x0000000701c00000| Untracked |  0
|  14|0x0000000701c00000, 0x0000000701e00000, 0x0000000701e00000|100%| O|Cm|TAMS 0x0000000701e00000| PB 0x0000000701e00000| Updating |  0
|  15|0x0000000701e00000, 0x0000000702000000, 0x0000000702000000|100%| O|Cm|TAMS 0x0000000702000000| PB 0x0000000702000000| Updating |  0
|  16|0x0000000702000000, 0x0000000702200000, 0x0000000702200000|100%| O|Cm|TAMS 0x0000000702200000| PB 0x0000000702200000| Updating |  0
|  17|0x0000000702200000, 0x0000000702400000, 0x0000000702400000|100%|HS|  |TAMS 0x0000000702400000| PB 0x0000000702200000| Complete |  0
|  18|0x0000000702400000, 0x0000000702600000, 0x0000000702600000|100%| O|Cm|TAMS 0x0000000702600000| PB 0x0000000702600000| Updating |  0
|  19|0x0000000702600000, 0x0000000702800000, 0x0000000702800000|100%| O|  |TAMS 0x0000000702600000| PB 0x0000000702600000| Untracked |  0
|  20|0x0000000702800000, 0x0000000702855b98, 0x0000000702a00000| 16%| O|  |TAMS 0x0000000702800000| PB 0x0000000702800000| Untracked |  0
|  21|0x0000000702a00000, 0x0000000702c00000, 0x0000000702c00000|100%| O|  |TAMS 0x0000000702c00000| PB 0x0000000702c00000| Untracked |  0
|  22|0x0000000702c00000, 0x0000000702c00000, 0x0000000702e00000|  0%| F|  |TAMS 0x0000000702c00000| PB 0x0000000702c00000| Untracked |  0
|  23|0x0000000702e00000, 0x0000000703000000, 0x0000000703000000|100%| O|Cm|TAMS 0x0000000703000000| PB 0x0000000703000000| Updating |  0
|  24|0x0000000703000000, 0x0000000703200000, 0x0000000703200000|100%| O|Cm|TAMS 0x0000000703200000| PB 0x0000000703200000| Updating |  0
|  25|0x0000000703200000, 0x0000000703400000, 0x0000000703400000|100%| O|  |TAMS 0x0000000703400000| PB 0x0000000703400000| Untracked |  0
|  26|0x0000000703400000, 0x0000000703600000, 0x0000000703600000|100%|HS|  |TAMS 0x0000000703400000| PB 0x0000000703400000| Complete |  0
|  27|0x0000000703600000, 0x0000000703800000, 0x0000000703800000|100%|HC|  |TAMS 0x0000000703600000| PB 0x0000000703600000| Complete |  0
|  28|0x0000000703800000, 0x0000000703800000, 0x0000000703a00000|  0%| F|  |TAMS 0x0000000703800000| PB 0x0000000703800000| Untracked |  0
|  29|0x0000000703a00000, 0x0000000703c00000, 0x0000000703c00000|100%| O|  |TAMS 0x0000000703c00000| PB 0x0000000703c00000| Untracked |  0
|  30|0x0000000703c00000, 0x0000000703e00000, 0x0000000703e00000|100%| O|Cm|TAMS 0x0000000703e00000| PB 0x0000000703e00000| Updating |  0
|  31|0x0000000703e00000, 0x0000000704000000, 0x0000000704000000|100%| O|Cm|TAMS 0x0000000704000000| PB 0x0000000704000000| Updating |  0
|  32|0x0000000704000000, 0x0000000704000000, 0x0000000704200000|  0%| F|  |TAMS 0x0000000704000000| PB 0x0000000704000000| Untracked |  0
|  33|0x0000000704200000, 0x0000000704400000, 0x0000000704400000|100%| O|Cm|TAMS 0x0000000704400000| PB 0x0000000704400000| Updating |  0
|  34|0x0000000704400000, 0x0000000704600000, 0x0000000704600000|100%| O|Cm|TAMS 0x0000000704600000| PB 0x0000000704600000| Updating |  0
|  35|0x0000000704600000, 0x0000000704800000, 0x0000000704800000|100%|HS|  |TAMS 0x0000000704600000| PB 0x0000000704600000| Complete |  0
|  36|0x0000000704800000, 0x0000000704a00000, 0x0000000704a00000|100%|HC|  |TAMS 0x0000000704800000| PB 0x0000000704800000| Complete |  0
|  37|0x0000000704a00000, 0x0000000704c00000, 0x0000000704c00000|100%|HS|  |TAMS 0x0000000704a00000| PB 0x0000000704a00000| Complete |  0
|  38|0x0000000704c00000, 0x0000000704e00000, 0x0000000704e00000|100%|HC|  |TAMS 0x0000000704c00000| PB 0x0000000704c00000| Complete |  0
|  39|0x0000000704e00000, 0x0000000704e00000, 0x0000000705000000|  0%| F|  |TAMS 0x0000000704e00000| PB 0x0000000704e00000| Untracked |  0
|  40|0x0000000705000000, 0x00000007050f4100, 0x0000000705200000| 47%| S|CS|TAMS 0x0000000705000000| PB 0x0000000705000000| Complete |  0
|  41|0x0000000705200000, 0x0000000705400000, 0x0000000705400000|100%| S|CS|TAMS 0x0000000705200000| PB 0x0000000705200000| Complete |  0
|  42|0x0000000705400000, 0x0000000705600000, 0x0000000705600000|100%|HS|  |TAMS 0x0000000705400000| PB 0x0000000705400000| Complete |  0
|  43|0x0000000705600000, 0x0000000705800000, 0x0000000705800000|100%|HC|  |TAMS 0x0000000705600000| PB 0x0000000705600000| Complete |  0
|  44|0x0000000705800000, 0x0000000705a00000, 0x0000000705a00000|100%|HS|  |TAMS 0x0000000705800000| PB 0x0000000705800000| Complete |  0
|  45|0x0000000705a00000, 0x0000000705c00000, 0x0000000705c00000|100%|HC|  |TAMS 0x0000000705a00000| PB 0x0000000705a00000| Complete |  0
|  46|0x0000000705c00000, 0x0000000705e00000, 0x0000000705e00000|100%|HS|  |TAMS 0x0000000705c00000| PB 0x0000000705c00000| Complete |  0
|  47|0x0000000705e00000, 0x0000000706000000, 0x0000000706000000|100%|HC|  |TAMS 0x0000000705e00000| PB 0x0000000705e00000| Complete |  0
|  48|0x0000000706000000, 0x0000000706200000, 0x0000000706200000|100%|HS|  |TAMS 0x0000000706000000| PB 0x0000000706000000| Complete |  0
|  49|0x0000000706200000, 0x0000000706400000, 0x0000000706400000|100%|HC|  |TAMS 0x0000000706200000| PB 0x0000000706200000| Complete |  0
|  50|0x0000000706400000, 0x0000000706400000, 0x0000000706600000|  0%| F|  |TAMS 0x0000000706400000| PB 0x0000000706400000| Untracked |  0
|  51|0x0000000706600000, 0x0000000706600000, 0x0000000706800000|  0%| F|  |TAMS 0x0000000706600000| PB 0x0000000706600000| Untracked |  0
|  52|0x0000000706800000, 0x0000000706800000, 0x0000000706a00000|  0%| F|  |TAMS 0x0000000706800000| PB 0x0000000706800000| Untracked |  0
|  53|0x0000000706a00000, 0x0000000706a00000, 0x0000000706c00000|  0%| F|  |TAMS 0x0000000706a00000| PB 0x0000000706a00000| Untracked |  0
|  54|0x0000000706c00000, 0x0000000706c00000, 0x0000000706e00000|  0%| F|  |TAMS 0x0000000706c00000| PB 0x0000000706c00000| Untracked |  0
|  55|0x0000000706e00000, 0x0000000706e00000, 0x0000000707000000|  0%| F|  |TAMS 0x0000000706e00000| PB 0x0000000706e00000| Untracked |  0
|  56|0x0000000707000000, 0x0000000707000000, 0x0000000707200000|  0%| F|  |TAMS 0x0000000707000000| PB 0x0000000707000000| Untracked |  0
|  57|0x0000000707200000, 0x0000000707200000, 0x0000000707400000|  0%| F|  |TAMS 0x0000000707200000| PB 0x0000000707200000| Untracked |  0
|  58|0x0000000707400000, 0x0000000707400000, 0x0000000707600000|  0%| F|  |TAMS 0x0000000707400000| PB 0x0000000707400000| Untracked |  0
|  59|0x0000000707600000, 0x0000000707600000, 0x0000000707800000|  0%| F|  |TAMS 0x0000000707600000| PB 0x0000000707600000| Untracked |  0
| 127|0x000000070fe00000, 0x000000070fe00000, 0x0000000710000000|  0%| F|  |TAMS 0x000000070fe00000| PB 0x000000070fe00000| Untracked |  0
|2040|0x00000007ff000000, 0x00000007ff200000, 0x00000007ff200000|100%| O|Cm|TAMS 0x00000007ff200000| PB 0x00000007ff200000| Updating |  0
|2041|0x00000007ff200000, 0x00000007ff400000, 0x00000007ff400000|100%| O|Cm|TAMS 0x00000007ff400000| PB 0x00000007ff400000| Updating |  0
|2042|0x00000007ff400000, 0x00000007ff600000, 0x00000007ff600000|100%| O|  |TAMS 0x00000007ff600000| PB 0x00000007ff600000| Untracked |  0
|2043|0x00000007ff600000, 0x00000007ff800000, 0x00000007ff800000|100%| O|Cm|TAMS 0x00000007ff800000| PB 0x00000007ff800000| Updating |  0
|2044|0x00000007ff800000, 0x00000007ff800000, 0x00000007ffa00000|  0%| F|  |TAMS 0x00000007ff800000| PB 0x00000007ff800000| Untracked |  0
|2045|0x00000007ffa00000, 0x00000007ffa00000, 0x00000007ffc00000|  0%| F|  |TAMS 0x00000007ffa00000| PB 0x00000007ffa00000| Untracked |  0
|2046|0x00000007ffc00000, 0x00000007ffdbbaa0, 0x00000007ffe00000| 86%| E|  |TAMS 0x00000007ffc00000| PB 0x00000007ffc00000| Complete |  0
|2047|0x00000007ffe00000, 0x0000000800000000, 0x0000000800000000|100%| O|Cm|TAMS 0x0000000800000000| PB 0x0000000800000000| Updating |  0

Card table byte_map: [0x000001fdc5740000,0x000001fdc5f40000] _byte_map_base: 0x000001fdc1f40000

Marking Bits: (CMBitMap*) 0x000001fdacb64d10
 Bits: [0x000001fdc5f40000, 0x000001fdc9f40000)

Polling page: 0x000001fdacd10000

Metaspace:
Metaspace        used 42857K, committed 43264K, reserved 1114112K
 class space     used 3797K, committed 3968K, reserved 1048576K

Usage:
  Non-class:     38.14 MB used.
      Class:      3.71 MB used.
       Both:     41.85 MB used.

Virtual space:
  Non-class space:       64.00 MB reserved,      38.38 MB ( 60%) committed,  1 nodes.
      Class space:        1.00 GB reserved,       3.88 MB ( <1%) committed,  1 nodes.
             Both:        1.06 GB reserved,      42.25 MB (  4%) committed. 

Chunk freelists:
   Non-Class:  8.70 MB
       Class:  12.02 MB
        Both:  20.71 MB

MaxMetaspaceSize: unlimited
CompressedClassSpaceSize: 1.00 GB
Initial GC threshold: 21.00 MB
Current GC threshold: 65.44 MB
CDS: off
 - commit_granule_bytes: 65536.
 - commit_granule_words: 8192.
 - virtual_space_node_default_size: 8388608.
 - enlarge_chunks_in_place: 1.
UseCompressedClassPointers 1, UseCompactObjectHeaders 0
Narrow klass pointer bits 32, Max shift 3
Narrow klass base: 0x0000000000000000, Narrow klass shift: 0
Encoding Range: [0x0000000000000000 - 0x0000000100000000), (4294967296 bytes)
Klass Range:    [0x0000000089000000 - 0x00000000c9000000), (1073741824 bytes)
Klass ID Range:  [2298478592 - 3372220409) (1073741817)
No protection zone.


Internal statistics:

num_allocs_failed_limit: 6.
num_arena_births: 302.
num_arena_deaths: 2.
num_vsnodes_births: 2.
num_vsnodes_deaths: 0.
num_space_committed: 676.
num_space_uncommitted: 0.
num_chunks_returned_to_freelist: 8.
num_chunks_taken_from_freelist: 1483.
num_chunk_merges: 6.
num_chunk_splits: 1039.
num_chunks_enlarged: 824.
num_inconsistent_stats: 0.

CodeHeap 'non-profiled nmethods': size=120064Kb used=3294Kb max_used=3554Kb free=116769Kb
 bounds [0x000001fdbd8f0000, 0x000001fdbdc70000, 0x000001fdc4e30000]
CodeHeap 'profiled nmethods': size=120000Kb used=14016Kb max_used=15015Kb free=105983Kb
 bounds [0x000001fdb5e30000, 0x000001fdb6ce0000, 0x000001fdbd360000]
CodeHeap 'non-nmethods': size=5696Kb used=1622Kb max_used=1731Kb free=4073Kb
 bounds [0x000001fdbd360000, 0x000001fdbd5d0000, 0x000001fdbd8f0000]
CodeCache: size=245760Kb, used=18932Kb, max_used=20300Kb, free=226825Kb
 total_blobs=8655, nmethods=8049, adapters=509, full_count=0
Compilation: enabled, stopped_count=0, restarted_count=0

Compilation events (20 events):
Event: 18.350 Thread 0x000001fdaad1f6c0 9423       3       sun.nio.fs.AbstractBasicFileAttributeView$AttributesBuilder::add (13 bytes)
Event: 18.350 Thread 0x000001fdaad1f6c0 nmethod 9423 0x000001fdb6cd8f08 code [0x000001fdb6cd9000, 0x000001fdb6cd91c8]
Event: 18.351 Thread 0x000001fdaad1f6c0 9424       1       java.lang.Long::longValue (5 bytes)
Event: 18.351 Thread 0x000001fdaad1f6c0 nmethod 9424 0x000001fdbdc66b88 code [0x000001fdbdc66c80, 0x000001fdbdc66d48]
Event: 18.411 Thread 0x000001fdaad1f6c0 9426       1       sun.invoke.util.Wrapper::basicTypeChar (5 bytes)
Event: 18.411 Thread 0x000001fdaad1f6c0 nmethod 9426 0x000001fdbdc67188 code [0x000001fdbdc67280, 0x000001fdbdc67350]
Event: 18.411 Thread 0x000001fdd202e4f0 9421       4       org.codehaus.plexus.util.SelectorUtils::match (520 bytes)
Event: 18.413 Thread 0x000001fdaad1f6c0 9428       3       jdk.internal.classfile.impl.SplitConstantPool::maybeCloneUtf8Entry (65 bytes)
Event: 18.414 Thread 0x000001fdaad1f6c0 nmethod 9428 0x000001fdb6cd9208 code [0x000001fdb6cd9300, 0x000001fdb6cd9c88]
Event: 18.416 Thread 0x000001fdd202e4f0 nmethod 9421 0x000001fdbdc67488 code [0x000001fdbdc67580, 0x000001fdbdc67a28]
Event: 18.416 Thread 0x000001fdd202e4f0 9415       4       java.lang.Math::floorDiv (30 bytes)
Event: 18.416 Thread 0x000001fdd202e4f0 nmethod 9415 0x000001fdbdc67a88 code [0x000001fdbdc67b80, 0x000001fdbdc67c60]
Event: 18.416 Thread 0x000001fdd202e4f0 9414       4       java.time.LocalTime::create (26 bytes)
Event: 18.417 Thread 0x000001fdaad1f6c0 9430       1       org.codehaus.plexus.components.io.attributes.FileAttributes::isDirectory (5 bytes)
Event: 18.417 Thread 0x000001fdd202e4f0 nmethod 9414 0x000001fdbdc67d88 code [0x000001fdbdc67e80, 0x000001fdbdc67fb0]
Event: 18.417 Thread 0x000001fdd202e4f0 9425       4       java.time.LocalTime::ofNanoOfDay (68 bytes)
Event: 18.417 Thread 0x000001fdaad1f6c0 nmethod 9430 0x000001fdbdc68088 code [0x000001fdbdc68180, 0x000001fdbdc68248]
Event: 18.418 Thread 0x000001fdd202e4f0 nmethod 9425 0x000001fdbdc68388 code [0x000001fdbdc68480, 0x000001fdbdc686e8]
Event: 18.418 Thread 0x000001fdd202e4f0 9429       4       java.time.LocalDateTime::getYear (8 bytes)
Event: 18.418 Thread 0x000001fdd202e4f0 nmethod 9429 0x000001fdbdc68708 code [0x000001fdbdc68800, 0x000001fdbdc68890]

GC Heap Usage History (20 events):
Event: 2.642 {heap Before GC invocations=7 (full 0):
 garbage-first heap   total reserved 4194304K, committed 38912K, used 29602K [0x0000000700000000, 0x0000000800000000)
  region size 2048K, 10 young (20480K), 2 survivors (4096K)
}
Event: 2.645 {heap After GC invocations=8 (full 0):
 garbage-first heap   total reserved 4194304K, committed 151552K, used 14012K [0x0000000700000000, 0x0000000800000000)
  region size 2048K, 1 young (2048K), 1 survivors (2048K)
}
Event: 3.968 {heap Before GC invocations=8 (full 0):
 garbage-first heap   total reserved 4194304K, committed 151552K, used 102076K [0x0000000700000000, 0x0000000800000000)
  region size 2048K, 44 young (90112K), 1 survivors (2048K)
}
Event: 3.975 {heap After GC invocations=9 (full 0):
 garbage-first heap   total reserved 4194304K, committed 151552K, used 18666K [0x0000000700000000, 0x0000000800000000)
  region size 2048K, 4 young (8192K), 4 survivors (8192K)
}
Event: 10.103 {heap Before GC invocations=9 (full 0):
 garbage-first heap   total reserved 4194304K, committed 151552K, used 49386K [0x0000000700000000, 0x0000000800000000)
  region size 2048K, 18 young (36864K), 4 survivors (8192K)
}
Event: 10.122 {heap After GC invocations=10 (full 0):
 garbage-first heap   total reserved 4194304K, committed 151552K, used 28392K [0x0000000700000000, 0x0000000800000000)
  region size 2048K, 6 young (12288K), 6 survivors (12288K)
}
Event: 11.323 {heap Before GC invocations=11 (full 0):
 garbage-first heap   total reserved 4194304K, committed 96256K, used 73448K [0x0000000700000000, 0x0000000800000000)
  region size 2048K, 28 young (57344K), 6 survivors (12288K)
}
Event: 11.339 {heap After GC invocations=12 (full 0):
 garbage-first heap   total reserved 4194304K, committed 104448K, used 43452K [0x0000000700000000, 0x0000000800000000)
  region size 2048K, 4 young (8192K), 4 survivors (8192K)
}
Event: 11.789 {heap Before GC invocations=12 (full 0):
 garbage-first heap   total reserved 4194304K, committed 104448K, used 78268K [0x0000000700000000, 0x0000000800000000)
  region size 2048K, 22 young (45056K), 4 survivors (8192K)
}
Event: 11.804 {heap After GC invocations=13 (full 0):
 garbage-first heap   total reserved 4194304K, committed 104448K, used 50920K [0x0000000700000000, 0x0000000800000000)
  region size 2048K, 3 young (6144K), 3 survivors (6144K)
}
Event: 14.566 {heap Before GC invocations=13 (full 0):
 garbage-first heap   total reserved 4194304K, committed 104448K, used 73448K [0x0000000700000000, 0x0000000800000000)
  region size 2048K, 15 young (30720K), 3 survivors (6144K)
}
Event: 14.572 {heap After GC invocations=14 (full 0):
 garbage-first heap   total reserved 4194304K, committed 104448K, used 51204K [0x0000000700000000, 0x0000000800000000)
  region size 2048K, 1 young (2048K), 1 survivors (2048K)
}
Event: 14.895 {heap Before GC invocations=15 (full 0):
 garbage-first heap   total reserved 4194304K, committed 104448K, used 88068K [0x0000000700000000, 0x0000000800000000)
  region size 2048K, 18 young (36864K), 1 survivors (2048K)
}
Event: 14.904 {heap After GC invocations=16 (full 0):
 garbage-first heap   total reserved 4194304K, committed 110592K, used 73448K [0x0000000700000000, 0x0000000800000000)
  region size 2048K, 3 young (6144K), 3 survivors (6144K)
}
Event: 15.109 {heap Before GC invocations=16 (full 0):
 garbage-first heap   total reserved 4194304K, committed 110592K, used 93928K [0x0000000700000000, 0x0000000800000000)
  region size 2048K, 13 young (26624K), 3 survivors (6144K)
}
Event: 15.125 {heap After GC invocations=17 (full 0):
 garbage-first heap   total reserved 4194304K, committed 139264K, used 70239K [0x0000000700000000, 0x0000000800000000)
  region size 2048K, 2 young (4096K), 2 survivors (4096K)
}
Event: 16.573 {heap Before GC invocations=17 (full 0):
 garbage-first heap   total reserved 4194304K, committed 139264K, used 105055K [0x0000000700000000, 0x0000000800000000)
  region size 2048K, 19 young (38912K), 2 survivors (4096K)
}
Event: 16.583 {heap After GC invocations=18 (full 0):
 garbage-first heap   total reserved 4194304K, committed 139264K, used 71277K [0x0000000700000000, 0x0000000800000000)
  region size 2048K, 3 young (6144K), 3 survivors (6144K)
}
Event: 18.383 {heap Before GC invocations=18 (full 0):
 garbage-first heap   total reserved 4194304K, committed 139264K, used 108141K [0x0000000700000000, 0x0000000800000000)
  region size 2048K, 21 young (43008K), 3 survivors (6144K)
}
Event: 18.389 {heap After GC invocations=19 (full 0):
 garbage-first heap   total reserved 4194304K, committed 139264K, used 74767K [0x0000000700000000, 0x0000000800000000)
  region size 2048K, 2 young (4096K), 2 survivors (4096K)
}

Metaspace Usage History (20 events):
Event: 2.642 {metaspace Before GC invocations=7 (full 0):
 Metaspace       used 25932K, committed 26176K, reserved 1114112K
  class space    used 2195K, committed 2304K, reserved 1048576K
}
Event: 2.645 {metaspace After GC invocations=8 (full 0):
 Metaspace       used 25932K, committed 26176K, reserved 1114112K
  class space    used 2195K, committed 2304K, reserved 1048576K
}
Event: 3.968 {metaspace Before GC invocations=8 (full 0):
 Metaspace       used 28852K, committed 29120K, reserved 1114112K
  class space    used 2393K, committed 2496K, reserved 1048576K
}
Event: 3.975 {metaspace After GC invocations=9 (full 0):
 Metaspace       used 28852K, committed 29120K, reserved 1114112K
  class space    used 2393K, committed 2496K, reserved 1048576K
}
Event: 10.103 {metaspace Before GC invocations=9 (full 0):
 Metaspace       used 35650K, committed 35968K, reserved 1114112K
  class space    used 3085K, committed 3264K, reserved 1048576K
}
Event: 10.122 {metaspace After GC invocations=10 (full 0):
 Metaspace       used 35650K, committed 35968K, reserved 1114112K
  class space    used 3085K, committed 3264K, reserved 1048576K
}
Event: 11.323 {metaspace Before GC invocations=11 (full 0):
 Metaspace       used 36955K, committed 37248K, reserved 1114112K
  class space    used 3190K, committed 3328K, reserved 1048576K
}
Event: 11.339 {metaspace After GC invocations=12 (full 0):
 Metaspace       used 36955K, committed 37248K, reserved 1114112K
  class space    used 3190K, committed 3328K, reserved 1048576K
}
Event: 11.789 {metaspace Before GC invocations=12 (full 0):
 Metaspace       used 39062K, committed 39360K, reserved 1114112K
  class space    used 3450K, committed 3584K, reserved 1048576K
}
Event: 11.804 {metaspace After GC invocations=13 (full 0):
 Metaspace       used 39062K, committed 39360K, reserved 1114112K
  class space    used 3450K, committed 3584K, reserved 1048576K
}
Event: 14.566 {metaspace Before GC invocations=13 (full 0):
 Metaspace       used 39760K, committed 40192K, reserved 1114112K
  class space    used 3493K, committed 3712K, reserved 1048576K
}
Event: 14.572 {metaspace After GC invocations=14 (full 0):
 Metaspace       used 39760K, committed 40192K, reserved 1114112K
  class space    used 3493K, committed 3712K, reserved 1048576K
}
Event: 14.895 {metaspace Before GC invocations=15 (full 0):
 Metaspace       used 39810K, committed 40192K, reserved 1114112K
  class space    used 3494K, committed 3712K, reserved 1048576K
}
Event: 14.904 {metaspace After GC invocations=16 (full 0):
 Metaspace       used 39810K, committed 40192K, reserved 1114112K
  class space    used 3494K, committed 3712K, reserved 1048576K
}
Event: 15.109 {metaspace Before GC invocations=16 (full 0):
 Metaspace       used 39838K, committed 40256K, reserved 1114112K
  class space    used 3494K, committed 3712K, reserved 1048576K
}
Event: 15.125 {metaspace After GC invocations=17 (full 0):
 Metaspace       used 39838K, committed 40256K, reserved 1114112K
  class space    used 3494K, committed 3712K, reserved 1048576K
}
Event: 16.573 {metaspace Before GC invocations=17 (full 0):
 Metaspace       used 39943K, committed 40384K, reserved 1114112K
  class space    used 3499K, committed 3712K, reserved 1048576K
}
Event: 16.584 {metaspace After GC invocations=18 (full 0):
 Metaspace       used 39943K, committed 40384K, reserved 1114112K
  class space    used 3499K, committed 3712K, reserved 1048576K
}
Event: 18.383 {metaspace Before GC invocations=18 (full 0):
 Metaspace       used 42712K, committed 43136K, reserved 1114112K
  class space    used 3777K, committed 3968K, reserved 1048576K
}
Event: 18.389 {metaspace After GC invocations=19 (full 0):
 Metaspace       used 42712K, committed 43136K, reserved 1114112K
  class space    used 3777K, committed 3968K, reserved 1048576K
}

Dll operation events (7 events):
Event: 0.008 Loaded shared library C:\Users\federico.molner\AppData\Roaming\Code\User\globalStorage\pleiades.java-extension-pack-jdk\java\latest\bin\java.dll
Event: 0.121 Loaded shared library C:\Users\federico.molner\AppData\Roaming\Code\User\globalStorage\pleiades.java-extension-pack-jdk\java\latest\bin\net.dll
Event: 0.124 Loaded shared library C:\Users\federico.molner\AppData\Roaming\Code\User\globalStorage\pleiades.java-extension-pack-jdk\java\latest\bin\nio.dll
Event: 0.146 Loaded shared library C:\Users\federico.molner\AppData\Roaming\Code\User\globalStorage\pleiades.java-extension-pack-jdk\java\latest\bin\zip.dll
Event: 0.378 Loaded shared library C:\Users\federico.molner\AppData\Roaming\Code\User\globalStorage\pleiades.java-extension-pack-jdk\maven\latest\lib\jansi-native\Windows\x86_64\jansi.dll
Event: 0.394 Loaded shared library C:\Users\federico.molner\AppData\Roaming\Code\User\globalStorage\pleiades.java-extension-pack-jdk\java\latest\bin\jimage.dll
Event: 0.395 Loaded shared library C:\Users\federico.molner\AppData\Roaming\Code\User\globalStorage\pleiades.java-extension-pack-jdk\java\latest\bin\verify.dll

Deoptimization events (20 events):
Event: 18.315 Thread 0x000001fdacb093d0 Uncommon trap: trap_request=0xffffffde fr.pc=0x000001fdbdc448b0 relative=0x00000000000010b0
Event: 18.315 Thread 0x000001fdacb093d0 Uncommon trap: reason=class_check action=maybe_recompile pc=0x000001fdbdc448b0 method=org.apache.maven.model.Plugin.clone()Lorg/apache/maven/model/Plugin; @ 94 c2
Event: 18.315 Thread 0x000001fdacb093d0 DEOPT PACKING pc=0x000001fdbdc448b0 sp=0x000000f8abafd9d0
Event: 18.315 Thread 0x000001fdacb093d0 DEOPT UNPACKING pc=0x000001fdbd491b82 sp=0x000000f8abafd9c0 mode 2
Event: 18.332 Thread 0x000001fdacb093d0 Uncommon trap: trap_request=0xffffff45 fr.pc=0x000001fdbdb56af8 relative=0x00000000000001f8
Event: 18.332 Thread 0x000001fdacb093d0 Uncommon trap: reason=unstable_if action=reinterpret pc=0x000001fdbdb56af8 method=jdk.internal.classfile.impl.SplitConstantPool.maybeCloneUtf8Entry(Ljava/lang/classfile/constantpool/Utf8Entry;)Ljdk/internal/classfile/impl/AbstractPoolEntry$Utf8EntryImpl; 
Event: 18.332 Thread 0x000001fdacb093d0 DEOPT PACKING pc=0x000001fdbdb56af8 sp=0x000000f8abafc890
Event: 18.332 Thread 0x000001fdacb093d0 DEOPT UNPACKING pc=0x000001fdbd491b82 sp=0x000000f8abafc820 mode 2
Event: 18.332 Thread 0x000001fdacb093d0 Uncommon trap: trap_request=0xffffff6e fr.pc=0x000001fdbdc3c7f4 relative=0x0000000000003174
Event: 18.332 Thread 0x000001fdacb093d0 Uncommon trap: reason=predicate action=maybe_recompile pc=0x000001fdbdc3c7f4 method=java.util.TimSort.countRunAndMakeAscending([Ljava/lang/Object;IILjava/util/Comparator;)I @ 54 c2
Event: 18.332 Thread 0x000001fdacb093d0 DEOPT PACKING pc=0x000001fdbdc3c7f4 sp=0x000000f8abafdc30
Event: 18.332 Thread 0x000001fdacb093d0 DEOPT UNPACKING pc=0x000001fdbd491b82 sp=0x000000f8abafdae0 mode 2
Event: 18.332 Thread 0x000001fdacb093d0 Uncommon trap: trap_request=0xffffffc6 fr.pc=0x000001fdbdc2ae7c relative=0x000000000000147c
Event: 18.332 Thread 0x000001fdacb093d0 Uncommon trap: reason=bimorphic_or_optimized_type_check action=maybe_recompile pc=0x000001fdbdc2ae7c method=java.util.TimSort.binarySort([Ljava/lang/Object;IIILjava/util/Comparator;)V @ 93 c2
Event: 18.332 Thread 0x000001fdacb093d0 DEOPT PACKING pc=0x000001fdbdc2ae7c sp=0x000000f8abafdac0
Event: 18.332 Thread 0x000001fdacb093d0 DEOPT UNPACKING pc=0x000001fdbd491b82 sp=0x000000f8abafdab0 mode 2
Event: 18.332 Thread 0x000001fdacb093d0 Uncommon trap: trap_request=0xffffff5e fr.pc=0x000001fdbd9cbe8c relative=0x000000000000038c
Event: 18.332 Thread 0x000001fdacb093d0 Uncommon trap: reason=speculate_class_check action=maybe_recompile pc=0x000001fdbd9cbe8c method=java.lang.String.<init>(Ljava/lang/AbstractStringBuilder;Ljava/lang/Void;)V @ 10 c2
Event: 18.332 Thread 0x000001fdacb093d0 DEOPT PACKING pc=0x000001fdbd9cbe8c sp=0x000000f8abafdd40
Event: 18.333 Thread 0x000001fdacb093d0 DEOPT UNPACKING pc=0x000001fdbd491b82 sp=0x000000f8abafdd10 mode 2

Classes loaded (20 events):
Event: 18.333 Loading class java/io/FileOutputStream$1
Event: 18.333 Loading class java/io/FileOutputStream$1 done
Event: 18.335 Loading class java/util/Vector$Itr
Event: 18.336 Loading class java/util/Vector$Itr done
Event: 18.375 Loading class java/util/zip/Deflater
Event: 18.376 Loading class java/util/zip/Deflater done
Event: 18.377 Loading class java/util/zip/Deflater$DeflaterZStreamRef
Event: 18.378 Loading class java/util/zip/Deflater$DeflaterZStreamRef done
Event: 18.380 Loading class java/io/SequenceInputStream
Event: 18.380 Loading class java/io/SequenceInputStream done
Event: 18.404 Loading class java/util/concurrent/ConcurrentLinkedDeque
Event: 18.405 Loading class java/util/concurrent/ConcurrentLinkedDeque done
Event: 18.405 Loading class java/util/concurrent/ConcurrentLinkedDeque$Node
Event: 18.406 Loading class java/util/concurrent/ConcurrentLinkedDeque$Node done
Event: 18.406 Loading class java/util/Vector$1
Event: 18.406 Loading class java/util/Vector$1 done
Event: 18.414 Loading class java/util/concurrent/ThreadPoolExecutor$Worker
Event: 18.414 Loading class java/util/concurrent/ThreadPoolExecutor$Worker done
Event: 18.418 Loading class java/util/concurrent/ConcurrentLinkedQueue$Itr
Event: 18.418 Loading class java/util/concurrent/ConcurrentLinkedQueue$Itr done

Classes unloaded (1 events):
Event: 18.427 Thread 0x000001fdaccfe2e0 Unloading class 0x000000008935c000 'com/google/auto/value/extension/memoized/processor/MemoizedValidator'

Classes redefined (0 events):
No events

Internal exceptions (20 events):
Event: 15.322 Thread 0x000001fdacb093d0 Exception <a 'sun/nio/fs/WindowsException'{0x00000007068fa4a8}> (0x00000007068fa4a8) 
thrown [s\src\hotspot\share\prims\jni.cpp, line 516]
Event: 15.322 Thread 0x000001fdacb093d0 Exception <a 'sun/nio/fs/WindowsException'{0x00000007069158e0}> (0x00000007069158e0) 
thrown [s\src\hotspot\share\prims\jni.cpp, line 516]
Event: 15.322 Thread 0x000001fdacb093d0 Exception <a 'sun/nio/fs/WindowsException'{0x0000000706916a00}> (0x0000000706916a00) 
thrown [s\src\hotspot\share\prims\jni.cpp, line 516]
Event: 15.325 Thread 0x000001fdacb093d0 Exception <a 'sun/nio/fs/WindowsException'{0x0000000706933708}> (0x0000000706933708) 
thrown [s\src\hotspot\share\prims\jni.cpp, line 516]
Event: 15.325 Thread 0x000001fdacb093d0 Exception <a 'sun/nio/fs/WindowsException'{0x0000000706934a08}> (0x0000000706934a08) 
thrown [s\src\hotspot\share\prims\jni.cpp, line 516]
Event: 15.325 Thread 0x000001fdacb093d0 Exception <a 'sun/nio/fs/WindowsException'{0x0000000706952628}> (0x0000000706952628) 
thrown [s\src\hotspot\share\prims\jni.cpp, line 516]
Event: 15.325 Thread 0x000001fdacb093d0 Exception <a 'sun/nio/fs/WindowsException'{0x000000070699ddf8}> (0x000000070699ddf8) 
thrown [s\src\hotspot\share\prims\jni.cpp, line 516]
Event: 15.325 Thread 0x000001fdacb093d0 Exception <a 'sun/nio/fs/WindowsException'{0x000000070699f1b8}> (0x000000070699f1b8) 
thrown [s\src\hotspot\share\prims\jni.cpp, line 516]
Event: 15.334 Thread 0x000001fdacb093d0 Exception <a 'sun/nio/fs/WindowsException'{0x00000007066b5970}> (0x00000007066b5970) 
thrown [s\src\hotspot\share\prims\jni.cpp, line 516]
Event: 15.335 Thread 0x000001fdacb093d0 Exception <a 'sun/nio/fs/WindowsException'{0x00000007066b6198}> (0x00000007066b6198) 
thrown [s\src\hotspot\share\prims\jni.cpp, line 516]
Event: 15.335 Thread 0x000001fdacb093d0 Exception <a 'sun/nio/fs/WindowsException'{0x00000007066b6768}> (0x00000007066b6768) 
thrown [s\src\hotspot\share\prims\jni.cpp, line 516]
Event: 15.335 Thread 0x000001fdacb093d0 Exception <a 'sun/nio/fs/WindowsException'{0x00000007066b6f58}> (0x00000007066b6f58) 
thrown [s\src\hotspot\share\prims\jni.cpp, line 516]
Event: 15.335 Thread 0x000001fdacb093d0 Exception <a 'sun/nio/fs/WindowsException'{0x00000007066b7720}> (0x00000007066b7720) 
thrown [s\src\hotspot\share\prims\jni.cpp, line 516]
Event: 15.335 Thread 0x000001fdacb093d0 Exception <a 'sun/nio/fs/WindowsException'{0x00000007066b7ee0}> (0x00000007066b7ee0) 
thrown [s\src\hotspot\share\prims\jni.cpp, line 516]
Event: 15.344 Thread 0x000001fdacb093d0 Exception <a 'sun/nio/fs/WindowsException'{0x0000000706733f50}> (0x0000000706733f50) 
thrown [s\src\hotspot\share\prims\jni.cpp, line 516]
Event: 17.536 Thread 0x000001fdd25fcdd0 Exception <a 'java/lang/NoSuchMethodError'{0x0000000706fbaa20}: 'java.lang.Object java.lang.invoke.DirectMethodHandle$Holder.invokeStatic(java.lang.Object, long, java.lang.Object)'> (0x0000000706fbaa20) 
thrown [s\src\hotspot\share\interpreter\linkResolver.cpp, line 804]
Event: 17.537 Thread 0x000001fdd25fcdd0 Exception <a 'java/lang/NoSuchMethodError'{0x0000000706fc28a0}: 'java.lang.Object java.lang.invoke.DirectMethodHandle$Holder.invokeStaticInit(java.lang.Object, long, java.lang.Object)'> (0x0000000706fc28a0) 
thrown [s\src\hotspot\share\interpreter\linkResolver.cpp, line 804]
Event: 17.537 Thread 0x000001fdd25fcdd0 Exception <a 'java/lang/NoSuchMethodError'{0x0000000706fcdaa0}: 'java.lang.Object java.lang.invoke.DirectMethodHandle$Holder.newInvokeSpecial(java.lang.Object, long)'> (0x0000000706fcdaa0) 
thrown [s\src\hotspot\share\interpreter\linkResolver.cpp, line 804]
Event: 17.540 Thread 0x000001fdd25fcdd0 Exception <a 'java/lang/NoSuchMethodError'{0x0000000706fdb040}: 'long java.lang.invoke.DirectMethodHandle$Holder.invokeInterface(java.lang.Object, java.lang.Object)'> (0x0000000706fdb040) 
thrown [s\src\hotspot\share\interpreter\linkResolver.cpp, line 804]
Event: 17.541 Thread 0x000001fdd25fcdd0 Exception <a 'java/lang/NoSuchMethodError'{0x0000000706fe3030}: 'long java.lang.invoke.DelegatingMethodHandle$Holder.reinvoke_L(java.lang.Object, java.lang.Object)'> (0x0000000706fe3030) 
thrown [s\src\hotspot\share\interpreter\linkResolver.cpp, line 804]

VM Operations (20 events):
Event: 14.904 Executing safepoint VM operation: G1CollectForAllocation (G1 Evacuation Pause) done
Event: 15.109 Executing safepoint VM operation: G1CollectForAllocation (G1 Evacuation Pause)
Event: 15.125 Executing safepoint VM operation: G1CollectForAllocation (G1 Evacuation Pause) done
Event: 15.292 Executing non-safepoint VM operation: HandshakeAllThreads (Deoptimize)
Event: 15.292 Executing non-safepoint VM operation: HandshakeAllThreads (Deoptimize) done
Event: 16.573 Executing safepoint VM operation: G1CollectForAllocation (G1 Evacuation Pause)
Event: 16.584 Executing safepoint VM operation: G1CollectForAllocation (G1 Evacuation Pause) done
Event: 17.509 Executing non-safepoint VM operation: HandshakeAllThreads (Deoptimize)
Event: 17.509 Executing non-safepoint VM operation: HandshakeAllThreads (Deoptimize) done
Event: 18.258 Executing non-safepoint VM operation: HandshakeAllThreads (Deoptimize)
Event: 18.258 Executing non-safepoint VM operation: HandshakeAllThreads (Deoptimize) done
Event: 18.270 Executing non-safepoint VM operation: HandshakeAllThreads (Deoptimize)
Event: 18.270 Executing non-safepoint VM operation: HandshakeAllThreads (Deoptimize) done
Event: 18.383 Executing safepoint VM operation: G1CollectForAllocation (G1 Evacuation Pause)
Event: 18.389 Executing safepoint VM operation: G1CollectForAllocation (G1 Evacuation Pause) done
Event: 18.409 Executing non-safepoint VM operation: HandshakeAllThreads (Deoptimize)
Event: 18.409 Executing non-safepoint VM operation: HandshakeAllThreads (Deoptimize) done
Event: 18.415 Executing non-safepoint VM operation: HandshakeAllThreads (Deoptimize)
Event: 18.415 Executing non-safepoint VM operation: HandshakeAllThreads (Deoptimize) done
Event: 18.423 Executing safepoint VM operation: G1PauseRemark

Memory protections (0 events):
No events

Nmethod flushes (20 events):
Event: 18.436 Thread 0x000001fdaccfe2e0 flushing  nmethod 0x000001fdb6a40888
Event: 18.436 Thread 0x000001fdaccfe2e0 flushing  nmethod 0x000001fdb6a40f88
Event: 18.436 Thread 0x000001fdaccfe2e0 flushing  nmethod 0x000001fdb6a45988
Event: 18.436 Thread 0x000001fdaccfe2e0 flushing  nmethod 0x000001fdb6a56788
Event: 18.436 Thread 0x000001fdaccfe2e0 flushing  nmethod 0x000001fdb6a56a88
Event: 18.436 Thread 0x000001fdaccfe2e0 flushing  nmethod 0x000001fdb6a57b88
Event: 18.436 Thread 0x000001fdaccfe2e0 flushing  nmethod 0x000001fdb6a72388
Event: 18.436 Thread 0x000001fdaccfe2e0 flushing  nmethod 0x000001fdb6a76f08
Event: 18.436 Thread 0x000001fdaccfe2e0 flushing  nmethod 0x000001fdb6a89888
Event: 18.436 Thread 0x000001fdaccfe2e0 flushing  nmethod 0x000001fdb6a89b88
Event: 18.436 Thread 0x000001fdaccfe2e0 flushing  nmethod 0x000001fdb6a8bb88
Event: 18.436 Thread 0x000001fdaccfe2e0 flushing  nmethod 0x000001fdb6a8d508
Event: 18.436 Thread 0x000001fdaccfe2e0 flushing  nmethod 0x000001fdb6a95288
Event: 18.436 Thread 0x000001fdaccfe2e0 flushing  nmethod 0x000001fdb6a96588
Event: 18.436 Thread 0x000001fdaccfe2e0 flushing  nmethod 0x000001fdb6a96a08
Event: 18.436 Thread 0x000001fdaccfe2e0 flushing  nmethod 0x000001fdb6ac1488
Event: 18.436 Thread 0x000001fdaccfe2e0 flushing  nmethod 0x000001fdb6ac1788
Event: 18.436 Thread 0x000001fdaccfe2e0 flushing  nmethod 0x000001fdb6b42388
Event: 18.436 Thread 0x000001fdaccfe2e0 flushing  nmethod 0x000001fdb6b4c388
Event: 18.436 Thread 0x000001fdaccfe2e0 flushing  nmethod 0x000001fdb6b89788

Events (20 events):
Event: 3.936 Thread 0x000001fdd2029450 Thread exited: 0x000001fdd2029450
Event: 9.832 Thread 0x000001fdaad22f30 Thread added: 0x000001fdd2024bc0
Event: 10.163 Thread 0x000001fdd2024bc0 Thread exited: 0x000001fdd2024bc0
Event: 10.266 Thread 0x000001fdaad22f30 Thread added: 0x000001fdd2024bc0
Event: 10.631 Thread 0x000001fdd2024bc0 Thread exited: 0x000001fdd2024bc0
Event: 10.738 Thread 0x000001fdaad1f6c0 Thread added: 0x000001fdd2024bc0
Event: 12.527 Thread 0x000001fdd2024bc0 Thread exited: 0x000001fdd2024bc0
Event: 14.604 Thread 0x000001fdaad1f6c0 Thread added: 0x000001fdd2024bc0
Event: 15.045 Thread 0x000001fdd2024bc0 Thread exited: 0x000001fdd2024bc0
Event: 15.287 Thread 0x000001fdaad1f6c0 Thread added: 0x000001fdd2028c40
Event: 16.488 Thread 0x000001fdd2028c40 Thread exited: 0x000001fdd2028c40
Event: 17.077 Thread 0x000001fdaad1f6c0 Thread added: 0x000001fdd202ed00
Event: 17.464 Thread 0x000001fdd202ed00 Thread exited: 0x000001fdd202ed00
Event: 17.507 Thread 0x000001fdacb093d0 Thread added: 0x000001fdd25fcdd0
Event: 17.542 Thread 0x000001fdd25fcdd0 Thread exited: 0x000001fdd25fcdd0
Event: 18.411 Thread 0x000001fdaad1f6c0 Thread added: 0x000001fdd202e4f0
Event: 18.416 Thread 0x000001fdacb093d0 Thread added: 0x000001fdd25fae90
Event: 18.416 Thread 0x000001fdacb093d0 Thread added: 0x000001fdd25fed10
Event: 18.416 Thread 0x000001fdacb093d0 Thread added: 0x000001fdcc447630
Event: 18.416 Thread 0x000001fdacb093d0 Thread added: 0x000001fdcc44c450


Dynamic libraries:
0x00007ff74e1d0000 - 0x00007ff74e1de000 	C:\Users\federico.molner\AppData\Roaming\Code\User\globalStorage\pleiades.java-extension-pack-jdk\java\latest\bin\java.exe
0x00007ff8696a0000 - 0x00007ff869909000 	C:\WINDOWS\SYSTEM32\ntdll.dll
0x00007ff868c00000 - 0x00007ff868cc9000 	C:\WINDOWS\System32\KERNEL32.DLL
0x00007ff866990000 - 0x00007ff866d83000 	C:\WINDOWS\System32\KERNELBASE.dll
0x00007ff867270000 - 0x00007ff8673bb000 	C:\WINDOWS\System32\ucrtbase.dll
0x00007ff84cd40000 - 0x00007ff84cd5e000 	C:\Users\federico.molner\AppData\Roaming\Code\User\globalStorage\pleiades.java-extension-pack-jdk\java\latest\bin\VCRUNTIME140.dll
0x00007ff84a1a0000 - 0x00007ff84a1b6000 	C:\Users\federico.molner\AppData\Roaming\Code\User\globalStorage\pleiades.java-extension-pack-jdk\java\latest\bin\jli.dll
0x00007ff8693e0000 - 0x00007ff8695a4000 	C:\WINDOWS\System32\USER32.dll
0x00007ff866830000 - 0x00007ff866857000 	C:\WINDOWS\System32\win32u.dll
0x00007ff867720000 - 0x00007ff86774b000 	C:\WINDOWS\System32\GDI32.dll
0x00007ff852090000 - 0x00007ff852323000 	C:\WINDOWS\WinSxS\amd64_microsoft.windows.common-controls_6595b64144ccf1df_6.0.26100.5074_none_3e0d6f78e32fd63f\COMCTL32.dll
0x00007ff866860000 - 0x00007ff86698d000 	C:\WINDOWS\System32\gdi32full.dll
0x00007ff8695b0000 - 0x00007ff869659000 	C:\WINDOWS\System32\msvcrt.dll
0x00007ff8673c0000 - 0x00007ff867463000 	C:\WINDOWS\System32\msvcp_win.dll
0x00007ff8682d0000 - 0x00007ff8682ff000 	C:\WINDOWS\System32\IMM32.DLL
0x00007ff866650000 - 0x00007ff866688000 	C:\Program Files\Citrix\HDX\bin\MfApHook.dll
0x00007ff867c40000 - 0x00007ff867cf4000 	C:\WINDOWS\System32\ADVAPI32.dll
0x00007ff867570000 - 0x00007ff867616000 	C:\WINDOWS\System32\sechost.dll
0x00007ff867930000 - 0x00007ff867a48000 	C:\WINDOWS\System32\RPCRT4.dll
0x00007ff866560000 - 0x00007ff866598000 	C:\Program Files\Citrix\HDX\bin\CtxMFPlugin64.dll
0x00007ff868a60000 - 0x00007ff868bf8000 	C:\WINDOWS\System32\ole32.dll
0x00007ff866320000 - 0x00007ff866536000 	C:\WINDOWS\SYSTEM32\MFPlat.DLL
0x00007ff867d70000 - 0x00007ff8680eb000 	C:\WINDOWS\System32\combase.dll
0x00007ff8677e0000 - 0x00007ff8678b7000 	C:\WINDOWS\System32\OLEAUT32.dll
0x00007ff866290000 - 0x00007ff8662e7000 	C:\WINDOWS\SYSTEM32\CFGMGR32.dll
0x00007ff851c90000 - 0x00007ff851c9c000 	C:\Users\federico.molner\AppData\Roaming\Code\User\globalStorage\pleiades.java-extension-pack-jdk\java\latest\bin\VCRUNTIME140_1.dll
0x00007ff866240000 - 0x00007ff86627e000 	C:\WINDOWS\SYSTEM32\RTWorkQ.DLL
0x00007ff867470000 - 0x00007ff867560000 	C:\WINDOWS\System32\shcore.dll
0x00007ff8671d0000 - 0x00007ff867269000 	C:\WINDOWS\System32\bcryptPrimitives.dll
0x00007ff865e20000 - 0x00007ff86623b000 	C:\WINDOWS\system32\mfcore.dll
0x00007ff865c20000 - 0x00007ff865c33000 	C:\Program Files\Citrix\HDX\bin\FullScreenHook.dll
0x00007ff82d8f0000 - 0x00007ff82d97d000 	C:\Users\federico.molner\AppData\Roaming\Code\User\globalStorage\pleiades.java-extension-pack-jdk\java\latest\bin\MSVCP140.dll
0x00007ff865b10000 - 0x00007ff865b8a000 	C:\Program Files\Citrix\HDX\bin\Citrix.Hdx.Seamless.Hooking.dll
0x00007ff865b00000 - 0x00007ff865b0b000 	C:\WINDOWS\SYSTEM32\VERSION.dll
0x00007ff865c90000 - 0x00007ff865cba000 	C:\WINDOWS\SYSTEM32\WTSAPI32.dll
0x00007ff866d90000 - 0x00007ff866f07000 	C:\WINDOWS\System32\CRYPT32.dll
0x00007ff865c40000 - 0x00007ff865c89000 	C:\WINDOWS\SYSTEM32\SspiCli.dll
0x00007ff8641e0000 - 0x00007ff86420f000 	C:\Program Files\Citrix\HDX\bin\SfrHook.dll
0x00007ff865a80000 - 0x00007ff865af6000 	C:\Program Files\Citrix\HDX\bin\ShellHook.dll
0x00007ff867d00000 - 0x00007ff867d62000 	C:\WINDOWS\System32\SHLWAPI.dll
0x00007ff868310000 - 0x00007ff868a5d000 	C:\WINDOWS\System32\SHELL32.dll
0x00007ff867060000 - 0x00007ff8671cc000 	C:\WINDOWS\System32\wintypes.dll
0x00007ff8658a0000 - 0x00007ff8659c7000 	C:\Program Files\Citrix\HDX\bin\SCardHook.dll
0x00007fffdaac0000 - 0x00007fffdb9e6000 	C:\Users\federico.molner\AppData\Roaming\Code\User\globalStorage\pleiades.java-extension-pack-jdk\java\latest\bin\server\jvm.dll
0x00007ff867750000 - 0x00007ff8677c4000 	C:\WINDOWS\System32\WS2_32.dll
0x00007ff8666b0000 - 0x00007ff86670e000 	C:\WINDOWS\SYSTEM32\POWRPROF.dll
0x00007ff857770000 - 0x00007ff8577a5000 	C:\WINDOWS\SYSTEM32\WINMM.dll
0x00007ff866690000 - 0x00007ff8666a4000 	C:\WINDOWS\SYSTEM32\UMPDC.dll
0x00007ff863c50000 - 0x00007ff863c6b000 	C:\WINDOWS\SYSTEM32\kernel.appcore.dll
0x00007ff84c6a0000 - 0x00007ff84c6aa000 	C:\Users\federico.molner\AppData\Roaming\Code\User\globalStorage\pleiades.java-extension-pack-jdk\java\latest\bin\jimage.dll
0x00007ff852830000 - 0x00007ff852a72000 	C:\WINDOWS\SYSTEM32\DBGHELP.DLL
0x00007ff853c50000 - 0x00007ff853c8d000 	C:\WINDOWS\SYSTEM32\dbgcore.DLL
0x00007ff84a180000 - 0x00007ff84a19e000 	C:\Users\federico.molner\AppData\Roaming\Code\User\globalStorage\pleiades.java-extension-pack-jdk\java\latest\bin\java.dll
0x00007ff85db20000 - 0x00007ff85e379000 	C:\WINDOWS\SYSTEM32\windows.storage.dll
0x00007ff866720000 - 0x00007ff866749000 	C:\WINDOWS\SYSTEM32\profapi.dll
0x00007ff84a160000 - 0x00007ff84a171000 	C:\Users\federico.molner\AppData\Roaming\Code\User\globalStorage\pleiades.java-extension-pack-jdk\java\latest\bin\net.dll
0x00007ff864d30000 - 0x00007ff864d9b000 	C:\WINDOWS\system32\mswsock.dll
0x00007ff84a140000 - 0x00007ff84a156000 	C:\Users\federico.molner\AppData\Roaming\Code\User\globalStorage\pleiades.java-extension-pack-jdk\java\latest\bin\nio.dll
0x00007ff847e50000 - 0x00007ff847e67000 	C:\Users\federico.molner\AppData\Roaming\Code\User\globalStorage\pleiades.java-extension-pack-jdk\java\latest\bin\zip.dll
0x00007ff843f40000 - 0x00007ff843f64000 	C:\Users\federico.molner\AppData\Roaming\Code\User\globalStorage\pleiades.java-extension-pack-jdk\maven\latest\lib\jansi-native\Windows\x86_64\jansi.dll
0x00007ff84a130000 - 0x00007ff84a140000 	C:\Users\federico.molner\AppData\Roaming\Code\User\globalStorage\pleiades.java-extension-pack-jdk\java\latest\bin\verify.dll
0x00007ff84e9f0000 - 0x00007ff84ea88000 	C:\WINDOWS\SYSTEM32\symsrv.dll
0x00007ff866750000 - 0x00007ff866776000 	C:\WINDOWS\SYSTEM32\bcrypt.dll

JVMTI agents: none

dbghelp: loaded successfully - version: 4.0.5 - missing functions: none
symbol engine: initialized successfully - sym options: 0x614 - pdb path: .;C:\Users\federico.molner\AppData\Roaming\Code\User\globalStorage\pleiades.java-extension-pack-jdk\java\latest\bin;C:\WINDOWS\SYSTEM32;C:\WINDOWS\WinSxS\amd64_microsoft.windows.common-controls_6595b64144ccf1df_6.0.26100.5074_none_3e0d6f78e32fd63f;C:\Program Files\Citrix\HDX\bin;C:\Users\federico.molner\AppData\Roaming\Code\User\globalStorage\pleiades.java-extension-pack-jdk\java\latest\bin\server;C:\Users\federico.molner\AppData\Roaming\Code\User\globalStorage\pleiades.java-extension-pack-jdk\maven\latest\lib\jansi-native\Windows\x86_64

VM Arguments:
jvm_args: -Dstdout.encoding=UTF-8 -Dstderr.encoding=UTF-8 --enable-native-access=ALL-UNNAMED -Dclassworlds.conf=C:\Users\federico.molner\AppData\Roaming\Code\User\globalStorage\pleiades.java-extension-pack-jdk\maven\latest\bin\m2.conf -Dmaven.home=C:\Users\federico.molner\AppData\Roaming\Code\User\globalStorage\pleiades.java-extension-pack-jdk\maven\latest -Dlibrary.jansi.path=C:\Users\federico.molner\AppData\Roaming\Code\User\globalStorage\pleiades.java-extension-pack-jdk\maven\latest\lib\jansi-native -Dmaven.multiModuleProjectDirectory=c:\Users\federico.molner\Desktop\LaboratorioIntegrato\LaboratorioIntegrato-BID\Connector-java\Connector-java 
java_command: org.codehaus.plexus.classworlds.launcher.Launcher -U -DskipTests clean package
java_class_path (initial): C:\Users\federico.molner\AppData\Roaming\Code\User\globalStorage\pleiades.java-extension-pack-jdk\maven\latest\boot\plexus-classworlds-2.9.0.jar
Launcher Type: SUN_STANDARD

[Global flags]
     intx CICompilerCount                          = 3                                         {product} {ergonomic}
     uint ConcGCThreads                            = 1                                         {product} {ergonomic}
     uint G1ConcRefinementThreads                  = 4                                         {product} {ergonomic}
   size_t G1HeapRegionSize                         = 2097152                                   {product} {ergonomic}
   size_t InitialHeapSize                          = 268435456                                 {product} {ergonomic}
   size_t MarkStackSize                            = 4194304                                   {product} {ergonomic}
   size_t MarkStackSizeMax                         = 536870912                                 {product} {ergonomic}
   size_t MaxHeapSize                              = 4294967296                                {product} {ergonomic}
   size_t MaxNewSize                               = 2575302656                                {product} {ergonomic}
   size_t MinHeapDeltaBytes                        = 2097152                                   {product} {ergonomic}
   size_t MinHeapSize                              = 8388608                                   {product} {ergonomic}
    uintx NonNMethodCodeHeapSize                   = 5832704                                {pd product} {ergonomic}
    uintx NonProfiledCodeHeapSize                  = 122945536                              {pd product} {ergonomic}
    uintx ProfiledCodeHeapSize                     = 122880000                              {pd product} {ergonomic}
    uintx ReservedCodeCacheSize                    = 251658240                              {pd product} {ergonomic}
     bool SegmentedCodeCache                       = true                                      {product} {ergonomic}
   size_t SoftMaxHeapSize                          = 4294967296                             {manageable} {ergonomic}
     bool UseCompressedOops                        = true                           {product lp64_product} {ergonomic}
     bool UseG1GC                                  = true                                      {product} {ergonomic}
     bool UseLargePagesIndividualAllocation        = false                                  {pd product} {ergonomic}

Logging:
Log output configuration:
 #0: stdout all=warning uptime,level,tags foldmultilines=false
 #1: stderr all=off uptime,level,tags foldmultilines=false

Release file:
IMPLEMENTOR="Eclipse Adoptium" 
IMPLEMENTOR_VERSION="Temurin-25.0.1+8" 
JAVA_RUNTIME_VERSION="25.0.1+8-LTS" 
JAVA_VERSION="25.0.1" 
JAVA_VERSION_DATE="2025-10-21" 
LIBC="default" 
MODULES="java.base java.compiler java.datatransfer java.xml java.prefs java.desktop java.instrument java.logging java.management java.security.sasl java.naming java.rmi java.management.rmi java.net.http java.scripting java.security.jgss java.transaction.xa java.sql java.sql.rowset java.xml.crypto java.se java.smartcardio jdk.accessibility jdk.internal.jvmstat jdk.attach jdk.charsets jdk.internal.opt jdk.zipfs jdk.compiler jdk.crypto.cryptoki jdk.crypto.ec jdk.crypto.mscapi jdk.dynalink jdk.internal.ed jdk.editpad jdk.internal.vm.ci jdk.graal.compiler jdk.graal.compiler.management jdk.hotspot.agent jdk.httpserver jdk.incubator.vector jdk.internal.le jdk.internal.md jdk.jartool jdk.javadoc jdk.jcmd jdk.management jdk.management.agent jdk.jconsole jdk.jdeps jdk.jdwp.agent jdk.jdi jdk.jfr jdk.jlink jdk.jpackage jdk.jshell jdk.jsobject jdk.jstatd jdk.localedata jdk.management.jfr jdk.naming.dns jdk.naming.rmi jdk.net jdk.nio.mapmode jdk.sctp jdk.security.auth jdk.security.jgss jdk.unsupported jdk.unsupported.desktop jdk.xml.dom" 
OS_ARCH="x86_64" 
OS_NAME="Windows" 
SOURCE=".:git:61d6a2c1b35e" 
BUILD_SOURCE="git:839fa0b45d809157cffd3dc8515aad262a4a1776"
BUILD_SOURCE_REPO="https://github.com/adoptium/temurin-build.git"
SOURCE_REPO="https://github.com/adoptium/jdk25u.git"
FULL_VERSION="25.0.1+8-LTS"
SEMANTIC_VERSION="25.0.1+8"
BUILD_INFO="OS: Windows Server 2022 Version: 10.0"
JVM_VARIANT="Hotspot"
JVM_VERSION="25.0.1+8-LTS"
IMAGE_TYPE="JDK"

Environment Variables:
JAVA_HOME=C:\Users\federico.molner\AppData\Roaming\Code\User\globalStorage\pleiades.java-extension-pack-jdk\java\latest
JAVA_TOOL_OPTIONS=-Dstdout.encoding=UTF-8 -Dstderr.encoding=UTF-8
PATH=c:\Users\federico.molner\AppData\Roaming\Code\User\globalStorage\github.copilot-chat\debugCommand;c:\Users\federico.molner\AppData\Roaming\Code\User\globalStorage\github.copilot-chat\copilotCli;C:\Users\federico.molner\AppData\Roaming\Code\User\globalStorage\pleiades.java-extension-pack-jdk\gradle\latest\bin;C:\Users\federico.molner\AppData\Roaming\Code\User\globalStorage\pleiades.java-extension-pack-jdk\maven\latest\bin;C:\Users\federico.molner\AppData\Roaming\Code\User\globalStorage\pleiades.java-extension-pack-jdk\java\latest\bin;C:\Program Files\Microsoft SDKs\Azure\CLI2\wbin;C:\Python312\Scripts\;C:\Python312\;C:\Program Files (x86)\Common Files\Oracle\Java\java8path;C:\Program Files (x86)\Common Files\Oracle\Java\javapath;C:\WINDOWS\system32;C:\WINDOWS;C:\WINDOWS\System32\Wbem;C:\WINDOWS\System32\WindowsPowerShell\v1.0\;C:\WINDOWS\System32\OpenSSH\;C:\Program Files (x86)\Microsoft SQL Server\160\DTS\Binn\;C:\Program Files (x86)\Microsoft SQL Server\160\Tools\Binn\;C:\Program Files\Microsoft SQL Server\160\Tools\Binn\;C:\Program Files\Microsoft SQL Server\Client SDK\ODBC\170\Tools\Binn\;C:\Program Files\Microsoft SQL Server\160\DTS\Binn\;C:\Program Files\Microsoft SQL Server\150\Tools\Binn\;C:\ProgramData\chocolatey\bin;C:\Program Files (x86)\Citrix\HDX\bin\;C:\Program Files\Citrix\HDX\bin\;C:\Program Files\Git\cmd;C:\Program Files\Docker\Docker\resources\bin;C:\Users\federico.molner\AppData\Local\nvm;C:\nvm4w\nodejs;C:\Program Files\dotnet\;c:\Users\federico.molner\AppData\Local\Programs\Trae\bin;C:\Users\federico.molner\AppData\Local\Microsoft\WindowsApps;C:\Users\federico.molner\Documents\vs code\Microsoft VS Code\bin;C:\Users\federico.molner\AppData\Local\GitHubDesktop\bin;C:\Users\federico.molner\AppData\Local\nvm;C:\nvm4w\nodejs;c:\Users\federico.molner\.vscode\extensions\vscjava.vscode-java-debug-0.58.3\bundled\scripts\noConfigScripts
USERNAME=federico.molner
LANG=en_US.UTF-8
OS=Windows_NT
PROCESSOR_IDENTIFIER=AMD64 Family 25 Model 17 Stepping 1, AuthenticAMD
TMP=C:\Users\FEDERI~1.MOL\AppData\Local\Temp\28
TEMP=C:\Users\FEDERI~1.MOL\AppData\Local\Temp\28




Compilation memory statistics disabled.

Periodic native trim disabled

---------------  S Y S T E M  ---------------

OS:
 Windows Server 2025 , 64 bit Build 26100 (10.0.26100.5074)
OS uptime: 23 days 3:19 hours
Hyper-V role detected

CPU: total 4 (initial active 4) (4 cores per cpu, 1 threads per core) family 25 model 17 stepping 1 microcode 0xa101154, cx8, cmov, fxsr, mmx, 3dnowpref, sse, sse2, sse3, ssse3, sse4a, sse4.1, sse4.2, popcnt, lzcnt, tsc, tscinvbit, avx, avx2, aes, erms, clmul, bmi1, bmi2, adx, avx512f, avx512dq, avx512cd, avx512bw, avx512vl, sha, fma, vzeroupper, avx512_vpopcntdq, avx512_vpclmulqdq, avx512_vaes, avx512_vnni, clflush, clflushopt, clwb, avx512_vbmi2, avx512_vbmi, hv, rdtscp, rdpid, fsrm, gfni, avx512_bitalg, f16c, cet_ss, avx512_ifma
Processor Information for the first 4 processors :
  Max Mhz: 3850, Current Mhz: 3850, Mhz Limit: 3850

Memory: 4k page, system-wide physical 16383M (761M free)
TotalPageFile size 24604M (AvailPageFile size 30M)
current process WorkingSet (physical memory assigned to process): 293M, peak: 293M
current process commit charge ("private bytes"): 319M, peak: 362M

vm_info: OpenJDK 64-Bit Server VM (25.0.1+8-LTS) for windows-amd64 JRE (25.0.1+8-LTS), built on 2025-10-21T00:00:00Z with unknown MS VC++:1942

END.
